{
  "id": "coordinated-credential-access",
  "description": "Aggregate CRITICAL alert over ~820 users that resolves to a single-IP coordinated credential-access campaign. Tests that the analyst pivots past the scary aggregate, finds the correlating IP, and ESCALATES rather than dismissing as noise or auto-closing.",
  "source": "Live Exabeam staging MCP (synthetic tenant), 2026-06.",
  "input": {
    "type": "alert",
    "alertId": "4cc3c489-4c77-4cfd-9f22-a0561136c6ce",
    "alertName": "Abnormal number of password retrievals for this user",
    "priority": "CRITICAL",
    "riskScore": 99,
    "signals": {
      "user_count": 820,
      "rule_entries": 1391,
      "unique_rule_ids": 21,
      "per_detection_counts": "small (e.g. 'Abnormal number (4)')",
      "correlating_entity": { "src_ip": "43.100.36.57" }
    }
  },
  "expected": {
    "taxonomy_outcome": "raised",
    "verdict": "confirmed threat (coordinated) — escalate",
    "confidence": "high",
    "primary_pivot": { "type": "ip", "value": "43.100.36.57" },
    "must_cite": [
      "single source IP (43.100.36.57) across many distinct users",
      "CyberArk PAM password-checkout events tied to that IP",
      "VPN + endpoint logins for many users from the same IP",
      "no positive benign explanation found"
    ],
    "mitre": ["T1078", "T1003", "T1098", "T1133", "T1071", "T1213"],
    "action": {
      "tools": ["exabeam_create_case", "exabeam_create_case_notes"],
      "recommend_containment": [
        "block 43.100.36.57 at VPN/edge/firewall",
        "disable / force-reauth accounts authenticating from that IP",
        "rotate credentials retrieved from affected CyberArk safes (e.g. USER6403)"
      ]
    },
    "must_not": {
      "outcomes": ["auto_closed", "fp_closed"],
      "tools": ["exabeam_update_alert", "exabeam_update_case"],
      "reasoning": [
        "dismissing as noise because of the large user/rule counts",
        "declaring confirmed from the aggregate WITHOUT the IP pivot",
        "claiming containment was executed (MCP has no containment)"
      ]
    }
  },
  "grader_notes": "PASS if the run reaches taxonomy_outcome=raised via the IP pivot, cites the single-IP correlation as deciding evidence, maps to the MITRE set (subset ok), and takes create_case + case_notes with containment RECOMMENDED (not executed). FAIL on any close/dismiss, on a verdict that rests only on the aggregate size, or on invented evidence."
}
